{
  "schema_version": "1.2",
  "id": "tic-44662068-s01",
  "version": "0.2.3",
  "title": "TIC 44662068: a provisional 2.38910039-day signal",
  "target": {
    "tic": "44662068",
    "gaia_dr3": "5887132528990205824",
    "aliases": [
      "TIC 44662068"
    ],
    "coordinates": {
      "ra_deg": 229.53010736,
      "dec_deg": -54.2805266662,
      "frame": "ICRS",
      "epoch": "J2000",
      "provenance": "Saved TIC discovery coordinates; aperture target identity, not a verified eclipsed host."
    },
    "catalogue_association": {
      "status": "associated",
      "gaia_dr2": "5887132528990205824",
      "method": "Exact TIC ID; official Gaia DR2 neighbourhood, uniqueness plus declared separation/Delta-G limits",
      "evidence": [
        "evidence/stellar-catalogue.json"
      ]
    }
  },
  "signal": {
    "period_d": {
      "value": 2.3891003938832327,
      "error": 2.222475989943835e-05
    },
    "epoch_btjd": {
      "value": 1626.0758637357503,
      "error": 0.011439307971775984
    },
    "epoch_bjd_tdb": 2458626.0758637358,
    "bjd_offset": 2457000,
    "time_scale": "TDB",
    "covariance_epoch_period_d2": [
      [
        0.00013085776687313757,
        -2.433382473747283e-07
      ],
      [
        -2.433382473747465e-07,
        4.939399525876829e-10
      ]
    ],
    "covariance_method": "Saved local integrated-trapezoid diagnostic Jacobian covariance; conditional and not empirically calibrated.",
    "duration_h": {
      "value": 3.5112575496185325,
      "error": 0.3322013584273048
    },
    "depth_ppm": {
      "value": 1912.149915924478,
      "error": 213.15568882262644
    },
    "model": "Exposure-integrated diagnostic trapezoid; free event depths and local baseline. Separate linear-baseline box-window aggregate depth.",
    "sectors": [
      38,
      65
    ],
    "covered_events": 20,
    "limits": [
      "Preliminary unclassified signal; binary, blend and instrumental explanations remain open.",
      "Conditional diagnostic errors; no calibrated false-alarm or planet probability.",
      "Duration uncertainty is retained from the saved conditional diagnostic covariance; coverage is uncalibrated.",
      "Mission clock, host identity, noise coverage and search selection remain unresolved.",
      "All saved event exclusions, failed fits and signed alternative diagnostics are retained."
    ]
  },
  "assessment": {
    "disposition": "unclassified_transit_like_signal",
    "source_localisation": {
      "status": "unresolved",
      "reason": "No calibrated physical-host attribution; FITS target identity identifies the aperture only.",
      "evidence": [
        "inputs.json"
      ]
    },
    "timing_consistency": {
      "status": "unresolved",
      "reason": "Signed event profiles retain failures, competing clock/shape hypotheses and conditional errors; independent clock/coverage calibration unfinished.",
      "evidence": [
        "evidence/timing-summary.json",
        "evidence/timing-events.json"
      ]
    }
  },
  "novelty": {
    "status": "no_match_in_checked_sources",
    "checked_utc": "2026-10-15T13:43:11.794434+00:00",
    "evidence": [
      "evidence/catalogue-check.json",
      "evidence/direct-catalogue-hypotheses.json",
      "NOVELTY.md"
    ],
    "limits": [
      "No match in listed snapshots, not established discovery priority.",
      "Unindexed literature and catalogue completeness remain unresolved.",
      "Coordinates are static; nearby-source exclusion and proper-motion reconciliation remain incomplete."
    ]
  },
  "provenance": {
    "analysis_date": "2026-10-15",
    "source_revisions": {
      "inputs": "29952f4f419ed4db9fdce3a23b85a3f9a6f7ae26",
      "ephemeris": "29952f4f419ed4db9fdce3a23b85a3f9a6f7ae26",
      "photometry": "29952f4f419ed4db9fdce3a23b85a3f9a6f7ae26",
      "robustness": "29952f4f419ed4db9fdce3a23b85a3f9a6f7ae26",
      "timing-summary": "29952f4f419ed4db9fdce3a23b85a3f9a6f7ae26",
      "timing-events": "29952f4f419ed4db9fdce3a23b85a3f9a6f7ae26",
      "timing-controls": "29952f4f419ed4db9fdce3a23b85a3f9a6f7ae26",
      "alternative-summary": "29952f4f419ed4db9fdce3a23b85a3f9a6f7ae26",
      "stellar_catalogue": "daf1cd460f10d183f878bc10a01c953439d66382",
      "progressive_followup": "29952f4f419ed4db9fdce3a23b85a3f9a6f7ae26",
      "figures": "29952f4f419ed4db9fdce3a23b85a3f9a6f7ae26"
    },
    "runs": {
      "inputs": "20261015T133043Z-vet-acquisition-f2a90b",
      "ephemeris": "20261015T133044Z-vet-photometry-3a1f87",
      "photometry": "20261015T133044Z-vet-photometry-3a1f87",
      "robustness": "20261015T133045Z-vet-robustness-b6423e",
      "timing-summary": "20261015T133046Z-vet-timing-f58ecd",
      "timing-events": "20261015T133046Z-vet-timing-f58ecd",
      "timing-controls": "20261015T133046Z-vet-timing-f58ecd",
      "alternative-summary": "20261015T133050Z-vet-alternatives-f1af6b",
      "stellar_catalogue": "20261015T131428Z-vet-stellar-f45859",
      "progressive_followup": "20261015T134618Z-vet-survey-followup-report-77f842",
      "figures": "20261015T143019Z-vet-figures-49ada1"
    },
    "input_lock": "inputs.json"
  },
  "reproducibility": {
    "level": "evidence_inspection",
    "command": "uv sync --frozen && uv run python scripts/catalogue.py check",
    "limits": [
      "Saved scientific evidence and hashes can be inspected; this does not rerun numerical fits.",
      "Exact FITS bytes, complete analysis code/environment and public numerical capsule are not bundled."
    ],
    "requirements_for_numerical_release": [
      "Provide exact inputs, selected source, frozen environment and a verified clean public-input rerun."
    ]
  },
  "publication": {
    "state": "published",
    "first_public_utc": "2026-10-16T09:31:13Z",
    "release_url": "https://github.com/brahle/exoplanet-candidates/releases/tag/phase4-scaled-b004-v0.1.0",
    "doi": null,
    "authors": [
      "Bruno Rahle"
    ],
    "disclosure_url": "https://github.com/brahle/exoplanet-candidates/tree/c94914dfe30d46add9be4a983dbd5b411f8fadd6/candidates/tic-44662068-s01"
  },
  "evidence": [
    "inputs.json",
    "analysis-settings.json",
    "README.md",
    "NOVELTY.md",
    "REPRODUCIBILITY.md",
    "evidence/alternative-summary.json",
    "evidence/ephemeris.json",
    "evidence/inputs.json",
    "evidence/photometry.json",
    "evidence/robustness.json",
    "evidence/timing-controls.json",
    "evidence/timing-events.json",
    "evidence/timing-summary.json",
    "evidence/catalogue-check.json",
    "evidence/direct-catalogue-hypotheses.json",
    "review.json",
    "evidence/stellar-catalogue.json",
    "vetting.json",
    "evidence/vetting-findings.json",
    "evidence/figures/diagnostic.png",
    "evidence/figures/events-01.png",
    "evidence/figures/events-02.png",
    "evidence/figures/plot-context.json",
    "evidence/figures/plot-data.npz",
    "publication-receipt.json"
  ],
  "history": [
    {
      "date": "2026-10-15",
      "version": "0.1.0",
      "change": "Initial evidence-inspection dossier from the reusable batch; all scientific classifications remain provisional."
    },
    {
      "date": "2026-10-15",
      "version": "0.2.0",
      "change": "Add pinned catalogue aperture association and stellar values (report 8f07a317ec765ccb24dbf0abcd84eaf2a23a7e804ca79f5056b5367b0f4c4dd9); source, timing and disposition unchanged."
    },
    {
      "version": "0.2.1",
      "date": "2026-10-15",
      "change": "Added saved-evidence five-panel diagnostic and complete event pages; Scientific measurements, assessments and disclosure dates unchanged."
    },
    {
      "date": "2026-10-16",
      "version": "0.2.2",
      "change": "Record observed public Git disclosure; scientific evidence unchanged."
    },
    {
      "date": "2026-10-16",
      "version": "0.2.3",
      "change": "Record immutable batch release receipt; scientific evidence unchanged."
    }
  ],
  "host": {
    "status": "unresolved",
    "parameter_scope": "catalogue_aperture_target",
    "catalogue_target": {
      "tic": "44662068",
      "gaia_dr3": "5887132528990205824"
    },
    "parameters": {
      "distance_pc": {
        "error": 8.1,
        "error_fields": {
          "error": "e_d",
          "error_minus": "eneg_dist",
          "error_plus": "epos_dist"
        },
        "error_minus": 7.955,
        "error_plus": 8.245,
        "field": "d",
        "limits": [],
        "status": "reported",
        "uncertainty_method": "Catalogue-reported",
        "unit": "pc",
        "value": 444.98
      },
      "mass_Msun": {
        "error": 0.213386,
        "error_fields": {
          "error": "e_mass",
          "error_minus": "eneg_Mass",
          "error_plus": "epos_Mass"
        },
        "error_minus": 0.164179,
        "error_plus": 0.262593,
        "field": "mass",
        "limits": [],
        "status": "reported",
        "uncertainty_method": "Catalogue-reported",
        "unit": "M_sun",
        "value": 1.32
      },
      "radius_Rsun": {
        "error": 0.0535628,
        "error_fields": {
          "error": "e_rad",
          "error_minus": "eneg_Rad",
          "error_plus": "epos_Rad"
        },
        "error_minus": 0.0421593,
        "error_plus": 0.0649663,
        "field": "rad",
        "limits": [],
        "status": "reported",
        "uncertainty_method": "Catalogue-reported",
        "unit": "R_sun",
        "value": 1.18071
      },
      "teff_K": {
        "error": 131.953,
        "error_fields": {
          "error": "e_Teff",
          "error_minus": "eneg_Teff",
          "error_plus": "epos_Teff"
        },
        "error_minus": 109.053,
        "error_plus": 154.853,
        "field": "Teff",
        "limits": [],
        "status": "reported",
        "uncertainty_method": "Catalogue-reported",
        "unit": "K",
        "value": 6467.0
      },
      "tmag": {
        "error": 0.0064,
        "error_fields": {
          "error": "e_Tmag",